{
  "$schema": "./standalone.schema.json",
  "schema_version": 1,
  "standalone_set_id": "https://github.com/0al-spec/agent-surface/publication/standalone-modules/v1",
  "authority": "non_authoritative_migration_candidate",
  "publication_mode_required": "transitional_monolith",
  "ownership_map": {
    "path": "publication/migration/module-ownership.json",
    "sha256": "befb554baf301051b89e16802a814b4c13ca674192f9fd2cafe182b3eb09fe0f"
  },
  "materialization": {
    "path": "publication/migration/materialization.json",
    "sha256": "df79f48944712be90cf9a9ccd9d2d32925fad99f73e18cfe0bc26b0601ba8447"
  },
  "generation_policy": {
    "content_order": "canonical_order_within_owner",
    "orphan_heading_policy": "promote_subtree_root_to_h2",
    "aggregate_title": "replace_with_reserved_document_title",
    "aggregate_toc": "replace_with_exact_document_set_navigation"
  },
  "reference_policy": {
    "normative_tuple": "document_id_exact_version",
    "navigation_anchor": "candidate_local_github_slug",
    "public_relocation": "old_tuple_to_new_tuple",
    "implicit_slugs": "non_public_navigation_only"
  },
  "documents": [
    {
      "document_id": "https://github.com/0al-spec/agent-surface/documents/core",
      "version": "0.1.0-draft.1",
      "title": "ASP Core",
      "target_source_path": "drafts/modules/core.md",
      "candidate_path": "publication/migration/documents/core.md",
      "sha256": "e763fbf577b9518660ca3acf6d602c0cbdea83a9cbe7741c67f5702953e11009",
      "content_fragments": [
        "modules/core/part-01.md",
        "modules/core/part-02.md",
        "modules/core/part-03.md",
        "modules/core/part-04.md",
        "modules/core/part-05.md",
        "modules/core/part-06.md",
        "modules/core/part-07.md",
        "modules/core/part-08.md"
      ],
      "normative_references": []
    },
    {
      "document_id": "https://github.com/0al-spec/agent-surface/documents/authorization",
      "version": "0.1.0-draft.1",
      "title": "ASP Delegated Authorization",
      "target_source_path": "drafts/modules/authorization.md",
      "candidate_path": "publication/migration/documents/authorization.md",
      "sha256": "abd40da48ff90f407ad18f291d8801bccf49683baa90723141d8aa5c5475c568",
      "content_fragments": [
        "modules/authorization/part-01.md",
        "modules/authorization/part-02.md",
        "modules/authorization/part-03.md",
        "modules/authorization/part-04.md",
        "modules/authorization/part-05.md"
      ],
      "normative_references": [
        {
          "document_id": "https://github.com/0al-spec/agent-surface/documents/core",
          "version": "0.1.0-draft.1",
          "candidate_path": "publication/migration/documents/core.md"
        }
      ]
    },
    {
      "document_id": "https://github.com/0al-spec/agent-surface/documents/safe-effects",
      "version": "0.1.0-draft.1",
      "title": "ASP Safe Effects",
      "target_source_path": "drafts/modules/safe-effects.md",
      "candidate_path": "publication/migration/documents/safe-effects.md",
      "sha256": "5ca1edb524fd1fd98c871598fbb05b30da355ccbcfe15a9862869f1f2828e51b",
      "content_fragments": [
        "modules/safe-effects/part-01.md",
        "modules/safe-effects/part-02.md",
        "modules/safe-effects/part-03.md",
        "modules/safe-effects/part-04.md"
      ],
      "normative_references": [
        {
          "document_id": "https://github.com/0al-spec/agent-surface/documents/core",
          "version": "0.1.0-draft.1",
          "candidate_path": "publication/migration/documents/core.md"
        },
        {
          "document_id": "https://github.com/0al-spec/agent-surface/documents/authorization",
          "version": "0.1.0-draft.1",
          "candidate_path": "publication/migration/documents/authorization.md"
        }
      ]
    },
    {
      "document_id": "https://github.com/0al-spec/agent-surface/documents/evidence",
      "version": "0.1.0-draft.1",
      "title": "ASP Evidence",
      "target_source_path": "drafts/modules/evidence.md",
      "candidate_path": "publication/migration/documents/evidence.md",
      "sha256": "9ce35ba3a2099715c268ddfef7c8a996892e700795c89454d27158de4bbe4c9c",
      "content_fragments": [
        "modules/evidence/part-01.md",
        "modules/evidence/part-02.md",
        "modules/evidence/part-03.md"
      ],
      "normative_references": [
        {
          "document_id": "https://github.com/0al-spec/agent-surface/documents/core",
          "version": "0.1.0-draft.1",
          "candidate_path": "publication/migration/documents/core.md"
        },
        {
          "document_id": "https://github.com/0al-spec/agent-surface/documents/authorization",
          "version": "0.1.0-draft.1",
          "candidate_path": "publication/migration/documents/authorization.md"
        },
        {
          "document_id": "https://github.com/0al-spec/agent-surface/documents/safe-effects",
          "version": "0.1.0-draft.1",
          "candidate_path": "publication/migration/documents/safe-effects.md"
        }
      ]
    },
    {
      "document_id": "https://github.com/0al-spec/agent-surface/documents/privacy",
      "version": "0.1.0-draft.1",
      "title": "ASP Privacy",
      "target_source_path": "drafts/modules/privacy.md",
      "candidate_path": "publication/migration/documents/privacy.md",
      "sha256": "672bd73ace635c6a12b80ff364e01e1100a23c34a669d0379d8ca71d63b9aa44",
      "content_fragments": [
        "modules/privacy/part-01.md",
        "modules/privacy/part-02.md",
        "modules/privacy/part-03.md"
      ],
      "normative_references": [
        {
          "document_id": "https://github.com/0al-spec/agent-surface/documents/core",
          "version": "0.1.0-draft.1",
          "candidate_path": "publication/migration/documents/core.md"
        },
        {
          "document_id": "https://github.com/0al-spec/agent-surface/documents/authorization",
          "version": "0.1.0-draft.1",
          "candidate_path": "publication/migration/documents/authorization.md"
        },
        {
          "document_id": "https://github.com/0al-spec/agent-surface/documents/evidence",
          "version": "0.1.0-draft.1",
          "candidate_path": "publication/migration/documents/evidence.md"
        }
      ]
    },
    {
      "document_id": "https://github.com/0al-spec/agent-surface/documents/bindings/asp-over-mcp",
      "version": "0.1.0-draft.1",
      "title": "ASP-over-MCP Binding",
      "target_source_path": "drafts/modules/bindings/asp-over-mcp.md",
      "candidate_path": "publication/migration/documents/bindings/asp-over-mcp.md",
      "sha256": "d781b417394e1b100d460bab29e01c1be009332579f4e849d2487608bab5bcc2",
      "content_fragments": [
        "modules/bindings/asp-over-mcp/part-01.md"
      ],
      "normative_references": [
        {
          "document_id": "https://github.com/0al-spec/agent-surface/documents/core",
          "version": "0.1.0-draft.1",
          "candidate_path": "publication/migration/documents/core.md"
        },
        {
          "document_id": "https://github.com/0al-spec/agent-surface/documents/authorization",
          "version": "0.1.0-draft.1",
          "candidate_path": "publication/migration/documents/authorization.md"
        },
        {
          "document_id": "https://github.com/0al-spec/agent-surface/documents/safe-effects",
          "version": "0.1.0-draft.1",
          "candidate_path": "publication/migration/documents/safe-effects.md"
        },
        {
          "document_id": "https://github.com/0al-spec/agent-surface/documents/evidence",
          "version": "0.1.0-draft.1",
          "candidate_path": "publication/migration/documents/evidence.md"
        }
      ]
    },
    {
      "document_id": "https://github.com/0al-spec/agent-surface/documents/conformance",
      "version": "0.1.0-draft.1",
      "title": "ASP Conformance",
      "target_source_path": "drafts/modules/conformance.md",
      "candidate_path": "publication/migration/documents/conformance.md",
      "sha256": "c74f85d8d038e63205a723c3712bb6f9ce90558023ddb9f1eb3b130d598e98c3",
      "content_fragments": [
        "modules/conformance/part-01.md"
      ],
      "normative_references": [
        {
          "document_id": "https://github.com/0al-spec/agent-surface/documents/core",
          "version": "0.1.0-draft.1",
          "candidate_path": "publication/migration/documents/core.md"
        },
        {
          "document_id": "https://github.com/0al-spec/agent-surface/documents/authorization",
          "version": "0.1.0-draft.1",
          "candidate_path": "publication/migration/documents/authorization.md"
        },
        {
          "document_id": "https://github.com/0al-spec/agent-surface/documents/safe-effects",
          "version": "0.1.0-draft.1",
          "candidate_path": "publication/migration/documents/safe-effects.md"
        },
        {
          "document_id": "https://github.com/0al-spec/agent-surface/documents/evidence",
          "version": "0.1.0-draft.1",
          "candidate_path": "publication/migration/documents/evidence.md"
        },
        {
          "document_id": "https://github.com/0al-spec/agent-surface/documents/privacy",
          "version": "0.1.0-draft.1",
          "candidate_path": "publication/migration/documents/privacy.md"
        },
        {
          "document_id": "https://github.com/0al-spec/agent-surface/documents/bindings/asp-over-mcp",
          "version": "0.1.0-draft.1",
          "candidate_path": "publication/migration/documents/bindings/asp-over-mcp.md"
        }
      ]
    }
  ],
  "navigation_references": [
    {
      "heading": "Authors' Contact Information",
      "source_document_id": "https://github.com/0al-spec/agent-surface/documents/core",
      "target_document_id": "https://github.com/0al-spec/agent-surface/documents/core",
      "target_version": "0.1.0-draft.1",